<?xml version="1.0" encoding="UTF-8"?>
<!-- edited with XMLSpy v2010 (http://www.altova.com) by Gert-Jan van Krevelen (Cane) -->
<xs:schema xmlns:xs="http://www.w3.org/2001/XMLSchema" elementFormDefault="qualified">
	<xs:element name="Terming">
		<xs:complexType>
			<xs:sequence>
				<xs:element name="Languages">
					<xs:complexType>
						<xs:sequence maxOccurs="unbounded">
							<xs:element name="Language">
								<xs:complexType>
									<xs:attribute name="id" use="required"/>
									<xs:attribute name="code" use="required"/>
									<xs:attribute name="description" use="required"/>
								</xs:complexType>
							</xs:element>
						</xs:sequence>
					</xs:complexType>
				</xs:element>
				<xs:element name="Terms">
					<xs:complexType>
						<xs:sequence maxOccurs="unbounded">
							<xs:element name="Term">
								<xs:complexType>
									<xs:sequence minOccurs="0" maxOccurs="unbounded">
										<xs:element name="Translation">
											<xs:complexType>
												<xs:attribute name="languageCode" use="required"/>
												<xs:attribute name="text" use="required"/>
											</xs:complexType>
										</xs:element>
									</xs:sequence>
									<xs:attribute name="id" use="required"/>
									<xs:attribute name="referer" use="required"/>
									<xs:attribute name="text" use="required"/>
								</xs:complexType>
							</xs:element>
						</xs:sequence>
					</xs:complexType>
				</xs:element>
			</xs:sequence>
		</xs:complexType>
	</xs:element>
</xs:schema>
